kind,title,htmlTitle,link,displayLink,snippet,htmlSnippet,formattedUrl,htmlFormattedUrl,pagemap.metatags,pagemap.cse_thumbnail,pagemap.cse_image,mime,fileFormat
customsearch#result,Bộ Tài chính thông báo về kế hoạch thi tuyển dụng công chức Cơ ...,Bộ Tài chính thông báo về kế hoạch thi <b>tuyển dụng</b> công chức Cơ ...,http://www.mof.gov.vn/webcenter/portal/btcvn/pages_r/l/tin-bo-tai-chinh?dDocName=MOFUCM310849,www.mof.gov.vn,Bộ Tài chính thông báo về kế hoạch thi tuyển dụng công chức Cơ quan Bộ Tài chính 03/05/2024 14:32:00 11090. Cỡ chữ:A- A+. Đọc báo. Tương phản:Giảm Tăng ...,Bộ Tài chính thông báo về kế hoạch thi <b>tuyển dụng</b> công chức Cơ quan Bộ Tài chính 03/05/<b>2024</b> 14:32:00 11090. Cỡ chữ:A- A+. Đọc báo. Tương phản:Giảm Tăng&nbsp;...,http://www.mof.gov.vn/webcenter/portal/btcvn/pages.../tin-bo-tai-chinh?...,http://www.mof.gov.vn/webcenter/portal/btcvn/pages.../tin-bo-tai-chinh?...,"[{'viewport': 'width=device-width, initial-scale=1', 'apple-mobile-web-app-capable': 'yes'}]",,,,
customsearch#result,Cổng TTĐT Kho Bạc Nhà Nước VN,Cổng TTĐT Kho Bạc Nhà Nước VN,https://vst.mof.gov.vn/webcenter/portal/kbnn/r/o/tb/tb_chitiet?dDocName=KBNN214995,vst.mof.gov.vn,Thông báo về việc tuyển dụng công chức Kho bạc Nhà nước năm 2024. 14/03/2024 09:00:49 Cỡ chữ:A-A+ Tương phản:Giảm Tăng. In bài. Thumbnails Document Outline,Thông báo về việc <b>tuyển dụng</b> công chức Kho bạc Nhà nước năm <b>2024</b>. 14/03/<b>2024</b> 09:00:49 Cỡ chữ:A-A+ Tương phản:Giảm Tăng. In bài. Thumbnails Document Outline,https://vst.mof.gov.vn/webcenter/portal/kbnn/r/o/tb/tb_chitiet?...,https://vst.mof.gov.vn/webcenter/portal/kbnn/r/o/tb/tb_chitiet?...,[{'og:url': 'http://vst.mof.gov.vn:80/webcenter/portal/kbnn/r/l/cm21001?dDocName=KBNN214995&dID=226130'}],,,,
customsearch#result,Bộ Tài chính - Kho bạc Nhà nước thông báo tuyển dụng công chức ...,Bộ Tài chính - Kho bạc Nhà nước thông báo <b>tuyển dụng</b> công chức ...,http://mof.gov.vn/webcenter/portal/btcvn/pages_r/l/tin-bo-tai-chinh?dDocName=MOFUCM305598,mof.gov.vn,Bộ Tài chính - Kho bạc Nhà nước thông báo tuyển dụng công chức KBNN năm 2024 14/03/2024 10:43:00 11427. Cỡ chữ:A- A+. Đọc báo. Tương phản:Giảm Tăng ...,Bộ Tài chính - Kho bạc Nhà nước thông báo <b>tuyển dụng</b> công chức KBNN năm <b>2024</b> 14/03/<b>2024</b> 10:43:00 11427. Cỡ chữ:A- A+. Đọc báo. Tương phản:Giảm Tăng&nbsp;...,http://mof.gov.vn/webcenter/portal/btcvn/pages_r/l/tin-bo-tai-chinh?...,http://mof.gov.vn/webcenter/portal/btcvn/pages_r/l/tin-bo-tai-chinh?...,"[{'viewport': 'width=device-width, initial-scale=1', 'apple-mobile-web-app-capable': 'yes'}]",,,,
customsearch#result,Bộ Tài chính - Ủy ban Chứng khoán NN thông báo tuyển dụng công ...,Bộ Tài chính - Ủy ban Chứng khoán NN thông báo <b>tuyển dụng</b> công ...,http://www.mof.gov.vn/webcenter/portal/btcvn/pages_r/l/tin-bo-tai-chinh?dDocName=MOFUCM303999,www.mof.gov.vn,Bộ Tài chính - Ủy ban Chứng khoán NN thông báo tuyển dụng công chức năm 2024 28/02/2024 09:57:00 4752. Cỡ chữ:A- A+. Đọc báo. Tương phản:Giảm Tăng ...,Bộ Tài chính - Ủy ban Chứng khoán NN thông báo <b>tuyển dụng</b> công chức năm <b>2024</b> 28/02/<b>2024</b> 09:57:00 4752. Cỡ chữ:A- A+. Đọc báo. Tương phản:Giảm Tăng&nbsp;...,http://www.mof.gov.vn/webcenter/portal/btcvn/pages.../tin-bo-tai-chinh?...,http://www.mof.gov.vn/webcenter/portal/btcvn/pages.../tin-bo-tai-chinh?...,"[{'viewport': 'width=device-width, initial-scale=1', 'apple-mobile-web-app-capable': 'yes'}]",,,,
customsearch#result,"Bộ Tài chính thông báo danh sách thí sinh dự thi Vòng 1, Kỳ tuyển ...","Bộ Tài chính thông báo danh sách thí sinh dự thi Vòng 1, Kỳ <b>tuyển</b> ...",http://www.mof.gov.vn/webcenter/portal/btcvn/pages_r/l/tin-bo-tai-chinh?dDocName=MOFUCM288849,www.mof.gov.vn,... 2024 (28/08/2023 10:08) · Bộ Tài chính - Cục quản lý giá thông báo kết quả ... Tuyển dụng · Đảng bộ Bộ Tài chính · Công khai ngân sách Bộ tài chính · Thông tin ...,... <b>2024</b> (28/08/2023 10:08) &middot; Bộ Tài chính - Cục quản lý giá thông báo kết quả ... <b>Tuyển dụng</b> &middot; Đảng bộ Bộ Tài chính &middot; Công khai ngân sách Bộ tài chính &middot; Thông tin&nbsp;...,http://www.mof.gov.vn/webcenter/portal/btcvn/pages.../tin-bo-tai-chinh?...,http://www.mof.gov.vn/webcenter/portal/btcvn/pages.../tin-bo-tai-chinh?...,"[{'viewport': 'width=device-width, initial-scale=1', 'apple-mobile-web-app-capable': 'yes'}]",,,,
customsearch#result,Ủy ban Chứng khoán Nhà nước: Trang chủ,Ủy ban Chứng khoán Nhà nước: Trang chủ,http://ssc.mof.gov.vn/,ssc.mof.gov.vn,"30/07/2024. Lễ trao Quyết định tuyển dụng công chức UBCKNN năm 2024. 29/07/2024. Lễ công bố và trao Quyết định điều động, bổ nhiệm công chức giữ chức vụ lãnh ...","30/07/<b>2024</b>. Lễ trao Quyết định <b>tuyển dụng</b> công chức UBCKNN năm <b>2024</b>. 29/07/<b>2024</b>. Lễ công bố và trao Quyết định điều động, bổ nhiệm công chức giữ chức vụ lãnh&nbsp;...",http://ssc.mof.gov.vn/,http://ssc.mof.gov.vn/,"[{'og:image': 'https://ssc.gov.vn/webcenter/oracle/webcenter/siteresources/scopedMD/shared/img/UBCK/no.png', 'og:type': 'article', 'og:image:width': '600', 'twitter:card': 'summary_large_image', 'og:site_name': 'ssc.gov.vn', 'author': 'ssc.gov.vn', 'og:title': 'CỔNG THÔNG TIN ĐIỆN TỬ - ỦY BAN CHỨNG KHOÁN NHÀ NƯỚC', 'og:image:height': '315', 'rating': 'GENERAL', 'site_path': 'https://ssc.gov.vn.vn', 'og:image:type': 'image/jpg', 'distribution': 'Global', 'og:description': 'CỔNG THÔNG TIN ĐIỆN TỬ - ỦY BAN CHỨNG KHOÁN NHÀ NƯỚC - Thông tin chứng khoán của Việt Nam mới nhất được cập nhật liên tục, chính xác và đầy đủ,chuyên sâu', 'twitter:image': 'https://ssc.gov.vn/webcenter/oracle/webcenter/siteresources/scopedMD/shared/img/UBCK/no.png', 'news_keywords': 'kinh tế,tài chính,chứng khoán,vnindex,hnx-index,upcom,hose,cập nhật,thông tin,chính xác,liên tục', 'viewport': 'width=device-width, initial-scale=1', 'apple-mobile-web-app-capable': 'yes', 'og:url': 'https://ssc.gov.vn/'}]","[{'src': 'https://encrypted-tbn0.gstatic.com/images?q=tbn:ANd9GcSHzu1mQ2TPC_hCPPw2bpk-45ib7CpSTpTxS4RIEFzuNTwizP3aeE-HopS0&s', 'width': '193', 'height': '261'}]",[{'src': 'https://ssc.gov.vn/webcenter/oracle/webcenter/siteresources/scopedMD/shared/img/UBCK/no.png'}],,
customsearch#result,Cổng TTĐT Kho Bạc Nhà Nước VN,Cổng TTĐT Kho Bạc Nhà Nước VN,https://vst.mof.gov.vn/webcenter/portal/kbnn/r/o/tb/tb_chitiet?dDocName=KBNN216814&dID=229368,vst.mof.gov.vn,KBNN thông báo Danh sách thí sinh đủ điều kiện dự thi vòng 1 Kỳ thi tuyển dụng công chức KBNN năm 2024. 24/06/2024 11:03:13 Cỡ chữ:A-A+ Tương phản:Giảm Tăng.,KBNN thông báo Danh sách thí sinh đủ điều kiện dự thi vòng 1 Kỳ thi <b>tuyển dụng</b> công chức KBNN năm <b>2024</b>. 24/06/<b>2024</b> 11:03:13 Cỡ chữ:A-A+ Tương phản:Giảm Tăng.,https://vst.mof.gov.vn/webcenter/portal/kbnn/r/o/tb/tb_chitiet?...dID...,https://vst.mof.gov.vn/webcenter/portal/kbnn/r/o/tb/tb_chitiet?...dID...,[{'og:url': 'http://vst.mof.gov.vn:80/webcenter/portal/kbnn/r/l/cm21001?dDocName=KBNN216814&dID=229368'}],,,,
customsearch#result,Bộ Tài chính - Kho bạc Nhà nước Trung ương thông báo danh sách ...,Bộ Tài chính - Kho bạc Nhà nước Trung ương thông báo danh sách ...,http://mof.gov.vn/webcenter/portal/btcvn/pages_r/l/tin-bo-tai-chinh?dDocName=MOFUCM317986,mof.gov.vn,"... dụng ngoại ngữ, tin học tại kỳ xét tuyển viên chức năm 2024 ... Bộ Tài chính - Tổng cục Dự trữ NN thông báo tuyển dụng công chức Tổng cục Dự trữ Nhà nước năm 2024 ...","... dụng ngoại ngữ, tin học tại kỳ xét tuyển viên chức năm <b>2024</b> ... Bộ Tài chính - Tổng cục Dự trữ NN thông báo <b>tuyển dụng</b> công chức Tổng cục Dự trữ Nhà nước năm <b>2024</b>&nbsp;...",http://mof.gov.vn/webcenter/portal/btcvn/pages_r/l/tin-bo-tai-chinh?...,http://mof.gov.vn/webcenter/portal/btcvn/pages_r/l/tin-bo-tai-chinh?...,"[{'viewport': 'width=device-width, initial-scale=1', 'apple-mobile-web-app-capable': 'yes'}]",,,,
customsearch#result,Bộ Tài chính Thông báo Kế hoạch xét tuyển dụng viên chức Viện ...,Bộ Tài chính Thông báo Kế hoạch xét <b>tuyển dụng</b> viên chức Viện ...,https://www.mof.gov.vn/webcenter/portal/vclvcstc/pages_r/l/chi-tiet-tin?dDocName=MOFUCM307178&dID=311951,www.mof.gov.vn,Bộ Tài chính Thông báo Kế hoạch xét tuyển dụng viên chức Viện Chiến lược và Chính sách tài chính năm 2024 29/03/2024 16:36:00 414. Cỡ chữ:A- A+.,Bộ Tài chính Thông báo Kế hoạch xét <b>tuyển dụng</b> viên chức Viện Chiến lược và Chính sách tài chính năm <b>2024</b> 29/03/<b>2024</b> 16:36:00 414. Cỡ chữ:A- A+.,https://www.mof.gov.vn/webcenter/portal/vclvcstc/pages.../chi-tiet-tin?...,https://www.mof.gov.vn/webcenter/portal/vclvcstc/pages.../chi-tiet-tin?...,"[{'viewport': 'width=device-width, initial-scale=1', 'apple-mobile-web-app-capable': 'yes'}]",,,,
customsearch#result,Bộ Tài chính - Kho bạc Nhà nước thông báo tuyển dụng công chức ...,Bộ Tài chính - Kho bạc Nhà nước thông báo <b>tuyển dụng</b> công chức ...,http://mof.gov.vn/webcenter/portal/btcvn/pages_r/l/tin-bo-tai-chinh?dDocName=MOFUCM257038,mof.gov.vn,4. Huong dan ghi phieu dang ky thi tuyen.doc · 3. Mau phieu dang ky thi tuyen.doc · 2. Phu luc 1 chi tieu tuyen dung cong chuc nghiep vu 2022.pdf ...,4. Huong dan ghi phieu dang ky thi tuyen.doc &middot; 3. Mau phieu dang ky thi tuyen.doc &middot; 2. Phu luc 1 chi tieu tuyen dung cong chuc nghiep vu 2022.pdf&nbsp;...,http://mof.gov.vn/webcenter/portal/btcvn/pages_r/l/tin-bo-tai-chinh?...,http://mof.gov.vn/webcenter/portal/btcvn/pages_r/l/tin-bo-tai-chinh?...,"[{'viewport': 'width=device-width, initial-scale=1', 'apple-mobile-web-app-capable': 'yes'}]",,,,
customsearch#result,Cổng TTĐT Kho Bạc Nhà Nước VN,Cổng TTĐT Kho Bạc Nhà Nước VN,https://vst.mof.gov.vn/webcenter/portal/kbnn/r/o/tb/tb_chitiet?dDocName=KBNN216618,vst.mof.gov.vn,KBNN Cao Bằng thông báo tuyển dụng HĐLĐ NĐ 111 năm 2024. 10/06/2024 11:00:34 Cỡ chữ:A-A+ Tương phản:Giảm Tăng. In bài. Thumbnails Document Outline,KBNN Cao Bằng thông báo <b>tuyển dụng</b> HĐLĐ NĐ 111 năm <b>2024</b>. 10/06/<b>2024</b> 11:00:34 Cỡ chữ:A-A+ Tương phản:Giảm Tăng. In bài. Thumbnails Document Outline,https://vst.mof.gov.vn/webcenter/portal/kbnn/r/o/tb/tb_chitiet?...,https://vst.mof.gov.vn/webcenter/portal/kbnn/r/o/tb/tb_chitiet?...,[{'og:url': 'http://vst.mof.gov.vn:80/webcenter/portal/kbnn/r/l/cm21001?dDocName=KBNN216618&dID=228921'}],,,,
customsearch#result,Cổng TTĐT Kho Bạc Nhà Nước VN,Cổng TTĐT Kho Bạc Nhà Nước VN,https://vst.mof.gov.vn/webcenter/portal/kbnn/r/o/tb/tb_chitiet?dDocName=KBNN215194,vst.mof.gov.vn,Kho bạc Nhà nước Sơn La thông báo tuyển lao động hợp đồng năm 2024. 19/03/2024 16:40:30 Cỡ chữ:A-A+ Tương phản:Giảm Tăng.,Kho bạc Nhà nước Sơn La thông báo <b>tuyển</b> lao động hợp đồng năm <b>2024</b>. 19/03/<b>2024</b> 16:40:30 Cỡ chữ:A-A+ Tương phản:Giảm Tăng.,https://vst.mof.gov.vn/webcenter/portal/kbnn/r/o/tb/tb_chitiet?...,https://vst.mof.gov.vn/webcenter/portal/kbnn/r/o/tb/tb_chitiet?...,[{'og:url': 'http://vst.mof.gov.vn:80/webcenter/portal/kbnn/r/l/cm21001?dDocName=KBNN215194&dID=226329'}],,,,
customsearch#result,Cổng TTĐT Kho Bạc Nhà Nước VN,Cổng TTĐT Kho Bạc Nhà Nước VN,https://vst.mof.gov.vn/webcenter/portal/kbnn/r/o/tb/tb_chitiet?dDocName=KBNN215592&dID=227125,vst.mof.gov.vn,KBNN Tuyên Quang thông báo kết quả xét tuyển và danh sách thí sinh trúng xét tuyển lao động hợp đồng. 09/04/2024 15:31:00 Cỡ chữ:A-A+ Tương phản:Giảm Tăng.,KBNN Tuyên Quang thông báo kết quả xét <b>tuyển</b> và danh sách thí sinh trúng xét <b>tuyển</b> lao động hợp đồng. 09/04/<b>2024</b> 15:31:00 Cỡ chữ:A-A+ Tương phản:Giảm Tăng.,https://vst.mof.gov.vn/webcenter/portal/kbnn/r/o/tb/tb_chitiet?...dID...,https://vst.mof.gov.vn/webcenter/portal/kbnn/r/o/tb/tb_chitiet?...dID...,[{'og:url': 'http://vst.mof.gov.vn:80/webcenter/portal/kbnn/r/l/cm21001?dDocName=KBNN215592&dID=227125'}],,,,
customsearch#result,"Bộ Tài chính thông báo số báo danh, phòng thi, ca thi, sơ dồ khu ...","Bộ Tài chính thông báo số báo danh, phòng thi, ca thi, sơ dồ khu ...",http://www.mof.gov.vn/webcenter/portal/btcvn/pages_r/l/tin-bo-tai-chinh?dDocName=MOFUCM319856,www.mof.gov.vn,"Bộ Tài chính thông báo số báo danh, phòng thi, ca thi, sơ dồ khu vực khai mạc, tổ chức thi Vòng 1, Kỳ tuyển dụng công chức Cơ quan Bộ Tài chính năm 2024 ...","Bộ Tài chính thông báo số báo danh, phòng thi, ca thi, sơ dồ khu vực khai mạc, tổ chức thi Vòng 1, Kỳ <b>tuyển dụng</b> công chức Cơ quan Bộ Tài chính năm <b>2024</b>&nbsp;...",http://www.mof.gov.vn/webcenter/portal/btcvn/pages.../tin-bo-tai-chinh?...,http://www.mof.gov.vn/webcenter/portal/btcvn/pages.../tin-bo-tai-chinh?...,"[{'viewport': 'width=device-width, initial-scale=1', 'apple-mobile-web-app-capable': 'yes'}]",,,,
customsearch#result,Thông báo tuyển dụng công chức UBCKNN năm 2024,Thông báo <b>tuyển dụng</b> công chức UBCKNN năm <b>2024</b>,https://m-portal.mof.gov.vn/webcenter/ShowProperty?nodeId=/UCM12/MOFUCM303999//idcPrimaryFile&revision=latestreleased&rid=1,m-portal.mof.gov.vn,"chi tiết chỉ tiêu tuyển dụng công chức ứng với từng vị trí việc làm theo Phụ lục số. 01 đính kèm). II. ĐIỀU KIỆN, TIÊU CHUẨN ĐĂNG KÝ DỰ TUYỂN:.","chi tiết chỉ tiêu <b>tuyển dụng</b> công chức ứng với từng vị trí việc làm theo Phụ lục số. 01 đính kèm). II. ĐIỀU KIỆN, TIÊU CHUẨN ĐĂNG KÝ DỰ TUYỂN:.",https://m-portal.mof.gov.vn/webcenter/ShowProperty?nodeId=/...,https://m-portal.mof.gov.vn/webcenter/ShowProperty?nodeId=/...,"[{'moddate': ""20240227174915+07'00''"", 'creator': 'Scanner System', 'creationdate': ""20240227174915+07'00''"", 'producer': 'Scanner System Image Conversion'}]","[{'src': 'https://encrypted-tbn0.gstatic.com/images?q=tbn:ANd9GcSw3kDJNodG2oazg9FNEoMdnt4VZvSKb13qKXJHuBd9RedooSpqzXUlnm2T&s', 'width': '189', 'height': '267'}]",[{'src': 'x-raw-image:///f62f0633dcfac31529b0184992efc8fe4610c36cfac282c80b13e65ff1d5c556'}],application/pdf,PDF/Adobe Acrobat
customsearch#result,Cổng TTĐT Kho Bạc Nhà Nước VN,Cổng TTĐT Kho Bạc Nhà Nước VN,https://vst.mof.gov.vn/webcenter/portal/kbnn/r/o/tb/tb_chitiet?dDocName=KBNN215386&dID=226919,vst.mof.gov.vn,KBNN Sóc Trăng thông báo về việc xét tuyển hợp đồng lao động. 29/03/2024 08:55:28 Cỡ chữ:A-A+ Tương phản:Giảm Tăng. In bài. Thumbnails Document Outline,KBNN Sóc Trăng thông báo về việc xét <b>tuyển</b> hợp đồng lao động. 29/03/<b>2024</b> 08:55:28 Cỡ chữ:A-A+ Tương phản:Giảm Tăng. In bài. Thumbnails Document Outline,https://vst.mof.gov.vn/webcenter/portal/kbnn/r/o/tb/tb_chitiet?...dID...,https://vst.mof.gov.vn/webcenter/portal/kbnn/r/o/tb/tb_chitiet?...dID...,[{'og:url': 'http://vst.mof.gov.vn:80/webcenter/portal/kbnn/r/l/cm21001?dDocName=KBNN215386&dID=226919'}],,,,
customsearch#result,Viện Chiến lược và chính sách tài chính thông báo kế hoạch mở ...,Viện Chiến lược và chính sách tài chính thông báo kế hoạch mở ...,https://www.mof.gov.vn/webcenter/portal/btcvn/pages_r/l/tin-bo-tai-chinh?dDocName=MOFUCM309024,www.mof.gov.vn,... 2024 16:18) · Bộ Tài chính - Kho bạc Nhà nước thông báo tuyển dụng công chức KBNN năm 2024 (14/03/2024 10:43) · Bộ Tài chính - Viện Chiến lược và chính sách tài ...,... <b>2024</b> 16:18) &middot; Bộ Tài chính - Kho bạc Nhà nước thông báo <b>tuyển dụng</b> công chức KBNN năm <b>2024</b> (14/03/<b>2024</b> 10:43) &middot; Bộ Tài chính - Viện Chiến lược và chính sách tài&nbsp;...,https://www.mof.gov.vn/webcenter/portal/btcvn/pages.../tin-bo-tai-chinh?...,https://www.mof.gov.vn/webcenter/portal/btcvn/pages.../tin-bo-tai-chinh?...,"[{'viewport': 'width=device-width, initial-scale=1', 'apple-mobile-web-app-capable': 'yes'}]",,,,
customsearch#result,Hoạt động kỷ niệm - Ủy ban Chứng khoán Nhà nước,Hoạt động kỷ niệm - Ủy ban Chứng khoán Nhà nước,https://ssc.mof.gov.vn/webcenter/portal/ubck/pages_r/m/tintc-skin/hotngknim,ssc.mof.gov.vn,Lễ công bố quyết định bổ nhiệm chức danh Thành viên Hội đồng thành viên và Tổng giám đốc VSDC · Lễ trao Quyết định tuyển dụng công chức UBCKNN năm 2024 · Lễ công ...,Lễ công bố quyết định bổ nhiệm chức danh Thành viên Hội đồng thành viên và Tổng giám đốc VSDC &middot; Lễ trao Quyết định <b>tuyển dụng</b> công chức UBCKNN năm <b>2024</b> &middot; Lễ công&nbsp;...,https://ssc.mof.gov.vn/webcenter/portal/ubck/pages_r/m/.../hotngknim,https://ssc.mof.gov.vn/webcenter/portal/ubck/pages_r/m/.../hotngknim,"[{'og:image': 'https://ssc.gov.vn/webcenter/oracle/webcenter/siteresources/scopedMD/shared/img/UBCK/no.png', 'og:type': 'article', 'og:image:width': '600', 'twitter:card': 'summary_large_image', 'og:site_name': 'ssc.gov.vn', 'author': 'ssc.gov.vn', 'og:title': 'CỔNG THÔNG TIN ĐIỆN TỬ - ỦY BAN CHỨNG KHOÁN NHÀ NƯỚC', 'og:image:height': '315', 'rating': 'GENERAL', 'site_path': 'https://ssc.gov.vn.vn', 'og:image:type': 'image/jpg', 'distribution': 'Global', 'og:description': 'CỔNG THÔNG TIN ĐIỆN TỬ - ỦY BAN CHỨNG KHOÁN NHÀ NƯỚC - Thông tin chứng khoán của Việt Nam mới nhất được cập nhật liên tục, chính xác và đầy đủ,chuyên sâu', 'twitter:image': 'https://ssc.gov.vn/webcenter/oracle/webcenter/siteresources/scopedMD/shared/img/UBCK/no.png', 'news_keywords': 'kinh tế,tài chính,chứng khoán,vnindex,hnx-index,upcom,hose,cập nhật,thông tin,chính xác,liên tục', 'viewport': 'width=device-width, initial-scale=1', 'apple-mobile-web-app-capable': 'yes', 'og:url': 'https://ssc.gov.vn/'}]","[{'src': 'https://encrypted-tbn0.gstatic.com/images?q=tbn:ANd9GcSHzu1mQ2TPC_hCPPw2bpk-45ib7CpSTpTxS4RIEFzuNTwizP3aeE-HopS0&s', 'width': '193', 'height': '261'}]",[{'src': 'https://ssc.gov.vn/webcenter/oracle/webcenter/siteresources/scopedMD/shared/img/UBCK/no.png'}],,
customsearch#result,Thông báo nội dung phỏng vấn vòng 2 kỳ tuyển dụng viên chức ...,Thông báo nội dung phỏng vấn vòng 2 kỳ <b>tuyển dụng</b> viên chức ...,https://mof.gov.vn/webcenter/portal/vclvcstc/pages_r/l/chi-tiet-tin?dDocName=MOFUCM319332,mof.gov.vn,Thông báo nội dung phỏng vấn vòng 2 kỳ tuyển dụng viên chức Viện Chiến lược và Chính sách tài chính năm 2024 04/07/2024 09:00:00 140. Cỡ chữ:A- A+. Đọc báo.,Thông báo nội dung phỏng vấn vòng 2 kỳ <b>tuyển dụng</b> viên chức Viện Chiến lược và Chính sách tài chính năm <b>2024</b> 04/07/<b>2024</b> 09:00:00 140. Cỡ chữ:A- A+. Đọc báo.,https://mof.gov.vn/webcenter/portal/vclvcstc/pages_r/l/chi-tiet-tin?...,https://mof.gov.vn/webcenter/portal/vclvcstc/pages_r/l/chi-tiet-tin?...,"[{'viewport': 'width=device-width, initial-scale=1', 'apple-mobile-web-app-capable': 'yes'}]",,,,
